{
  "version": "1.0.0",
  "id": "S-089",
  "beat_ref": {"thread_id": "main", "beat_id": "B-006"},
  "text": "The Relay hummed like a cathedral pipe—faithful and dangerous.",
  "meta": {"wordcount": 104, "pov": "3rd-limited", "tense": "past", "characters_present": ["CHAR-CAPTAIN", "CHAR-NAV"], "continuity": ["prop:access-card-present"]}
}
